{
  "runtime": "codex",
  "version": "0.1.0-beta.12",
  "support": "beta-supported",
  "canonical": false,
  "contract": "../shared/runtime-contract.json",
  "capabilities": [
    "read-files",
    "inspect-repository",
    "read-memory",
    "apply-scoped-edits",
    "run-or-report-validation",
    "follow-workflows",
    "perform-reviews",
    "report-execution-evidence",
    "route-tasks",
    "build-context-packs",
    "validate-task-envelopes",
    "validate-execution-results",
    "create-checkpoints",
    "handoff-tasks",
    "resume-execution",
    "decompose-workstreams",
    "claim-resources",
    "detect-workstream-conflicts",
    "reconcile-results",
    "build-project-briefs",
    "create-session-briefs",
    "audit-memory-freshness",
    "build-resume-packets",
    "audit-memory-drift",
    "validate-sources-of-truth",
    "build-reconciliation-proposals",
    "refresh-continuity-artifacts",
    "create-evidence-records",
    "map-change-provenance",
    "record-manual-deployments",
    "build-audit-bundles",
    "verify-evidence-integrity",
    "evaluate-policies",
    "validate-version-transitions",
    "preflight-manual-deployments",
    "manage-policy-exceptions"
  ],
  "implementation": "adapters/codex/",
  "limitations": [
    "Tool names and invocation differ from Claude Code."
  ]
}
